{
  "schema_version": 1,
  "generated_at": "2026-07-27T14:28:37.948Z",
  "catalog_ttl_seconds": 21600,
  "launcher": {
    "latest_version": "1.0.0",
    "manifest_url": "https://ClyntiaAikaHanaa.github.io/plugin-catalog/launcher/latest.json",
    "minimum_supported_version": "1.0.0"
  },
  "daw_processes": [
    {
      "name": "FL Studio",
      "executables": [
        "FL64.exe",
        "FL.exe"
      ]
    },
    {
      "name": "Ableton Live",
      "executables": [
        "Ableton Live 11 Suite.exe",
        "Ableton Live 11 Standard.exe",
        "Ableton Live 12 Suite.exe",
        "Ableton Live 12 Standard.exe",
        "Ableton Live 12 Intro.exe"
      ]
    },
    {
      "name": "REAPER",
      "executables": [
        "reaper.exe",
        "reaper_host_x64.exe"
      ]
    },
    {
      "name": "Bitwig Studio",
      "executables": [
        "BitwigStudio.exe",
        "BitwigPluginHost64.exe"
      ]
    },
    {
      "name": "Cubase",
      "executables": [
        "Cubase12.exe",
        "Cubase13.exe",
        "Cubase14.exe"
      ]
    },
    {
      "name": "Nuendo",
      "executables": [
        "Nuendo13.exe",
        "Nuendo14.exe"
      ]
    },
    {
      "name": "Studio One",
      "executables": [
        "Studio One.exe"
      ]
    },
    {
      "name": "Pro Tools",
      "executables": [
        "ProTools.exe"
      ]
    },
    {
      "name": "Cakewalk",
      "executables": [
        "Cakewalk.exe"
      ]
    },
    {
      "name": "Reason",
      "executables": [
        "Reason.exe"
      ]
    },
    {
      "name": "Waveform",
      "executables": [
        "Waveform.exe"
      ]
    },
    {
      "name": "Mixcraft",
      "executables": [
        "Mixcraft.exe"
      ]
    },
    {
      "name": "Plugin scanner",
      "executables": [
        "plugin-scan.exe",
        "VstScanner.exe"
      ]
    }
  ],
  "categories": [
    {
      "id": "dynamics",
      "label": "Dynamics"
    },
    {
      "id": "reverb",
      "label": "Reverb & Delay"
    },
    {
      "id": "eq",
      "label": "EQ & Filter"
    },
    {
      "id": "modulation",
      "label": "Modulation"
    },
    {
      "id": "distortion",
      "label": "Distortion & Saturation"
    },
    {
      "id": "utility",
      "label": "Utility"
    }
  ],
  "plugins": [
    {
      "id": "dihtortion",
      "name": "Dihtortion",
      "vendor": "AnakBaek DSP",
      "category": "distortion",
      "tagline": "Simulator amplifier gitar dan asymmetric wavefolder",
      "description": "Dihtortion punya dua kepribadian, dipilih lewat toggle **AMP MODE**.\n\n*Raw distortion* adalah taman bermain waveshaping: delapan kurva transfer yang melewati satu mesin anti-aliasing. *Amp Mode* adalah amplifier gitar penuh dengan jalur amp yang dimodelkan secara fisik, empat cabinet, dan impulse response ruangan.\n\nDitulis dalam C++17 di atas JUCE 7.0.12.",
      "homepage_url": "https://github.com/ClyntiaAikaHanaa/Dihtortion",
      "source_url": "https://github.com/ClyntiaAikaHanaa/Dihtortion",
      "license": "GPL-3.0",
      "hidden": false,
      "deprecated": false,
      "deprecation_notice": null,
      "commercial": {
        "model": "free",
        "requires_license": false,
        "purchase_url": null
      },
      "latest": {
        "version": "2.0.0",
        "released_at": "2026-07-27T00:00:00Z",
        "breaking": false,
        "security": false,
        "min_launcher_version": "1.0.0",
        "changelog": "### 2.0.0\n- Rilis pertama yang dapat dipasang lewat Studio Hub",
        "builds": [
          {
            "target": "windows-x86_64",
            "format": "vst3",
            "url": "https://github.com/ClyntiaAikaHanaa/Dihtortion/releases/download/v2.0.0/Dihtortion-2.0.0-win64.zip",
            "size_bytes": 4853200,
            "sha256": "c6ffc21d51360eb06023ec39032870bc2d2ed36973b5cd12c4aeebaf3faaeef2",
            "archive_root": "Dihtortion.vst3",
            "install_kind": "vst3_bundle",
            "requires_vc_redist": true
          }
        ]
      },
      "user_data": {
        "preset_paths": [],
        "config_paths": []
      },
      "requirements": {
        "os_min_build": 17763,
        "cpu_features": [
          "sse2"
        ],
        "disk_bytes": 60000000
      }
    },
    {
      "id": "lazerator",
      "name": "Lazerator",
      "vendor": "AnakBaek DSP",
      "category": "modulation",
      "tagline": "Dynamic transient smearing dan auto sweep phase modulator",
      "description": "Efek fase kreatif. Deretan all-pass filter digerakkan detektor transient, sehingga setiap hit memicu sweep frekuensi eksponensialnya sendiri.\n\nPhase smearing sudah lama jadi bagian kosakata bass music; Lazerator membuatnya mengikuti dinamika materi, bukan LFO yang berjalan sendiri.\n\nDitulis dalam C++20 di atas JUCE 8.0.4.",
      "homepage_url": "https://github.com/ClyntiaAikaHanaa/Lazerator",
      "source_url": "https://github.com/ClyntiaAikaHanaa/Lazerator",
      "license": "GPL-3.0",
      "hidden": false,
      "deprecated": false,
      "deprecation_notice": null,
      "commercial": {
        "model": "free",
        "requires_license": false,
        "purchase_url": null
      },
      "latest": {
        "version": "1.1.0",
        "released_at": "2026-07-26T00:00:00Z",
        "breaking": false,
        "security": false,
        "min_launcher_version": "1.0.0",
        "changelog": "### 1.1.0\n- Rilis pertama yang dapat dipasang lewat Studio Hub",
        "builds": [
          {
            "target": "windows-x86_64",
            "format": "vst3",
            "url": "https://github.com/ClyntiaAikaHanaa/Lazerator/releases/download/v1.1.0/Lazerator-1.1.0-win64.zip",
            "size_bytes": 2785364,
            "sha256": "3acb6650f604cd9d0772296529432e22118fe407c54413876c047d86580ddc86",
            "archive_root": "Lazerator.vst3",
            "install_kind": "vst3_bundle",
            "requires_vc_redist": true
          }
        ]
      },
      "user_data": {
        "preset_paths": [
          "%USERPROFILE%\\Documents\\Lazerator\\Presset"
        ],
        "config_paths": []
      },
      "requirements": {
        "os_min_build": 17763,
        "cpu_features": [
          "sse2"
        ],
        "disk_bytes": 40000000
      }
    }
  ]
}
